{"$schema":"http://json-schema.org/draft-07/schema#","properties":{"$schema":{"const":"./i18n-schema.json"},"cmd_help":{"type":"string"},"cmd_quit":{"type":"string"},"cmd_startGame":{"type":"string"},"cmd_startHelp":{"type":"string"},"cmd_type":{"type":"string"},"createBy":{"type":"string"},"desc":{"type":"string"},"version":{"type":"string"}},"required":["$schema","cmd_help","cmd_quit","cmd_startGame","cmd_startHelp","cmd_type","createBy","desc","version"],"additionalProperties":false,"title":"vimdoku-${principal.name}-i18n","type":"object"}